{
  "as_of": "2026-09-28",
  "attempt_id": "replay-daily-v1-attempt",
  "data_digest": "sha256:1c576c38215008cccd7c43d42ae7fb7a35bf5f7a541adc36b7f24e7f9e74dc35",
  "data_path": "crypto_cutoff.jsonl",
  "dataset_id": "crypto_cutoff",
  "endpoint_path": "/offline-replay/post-mcp-materialization",
  "key_fields": [
    "T",
    "t_2"
  ],
  "market": "Crypto",
  "materialization_status": "VERIFIED",
  "params": {
    "fixture": "daily-v1"
  },
  "requirement": "CORE",
  "research_cutoff": "2026-09-28T23:59:59Z",
  "retrieved_at": "2026-09-29T00:00:00Z",
  "row_count": 6,
  "run_id": "replay-daily-v1",
  "sort_fields": [
    "T",
    "t_2"
  ],
  "source_chunks": []
}
