{
  "as_of": "2026-09-28",
  "attempt_id": "replay-daily-v1-attempt",
  "data_digest": "sha256:fb9ed09f424f999fb45e18a12cae3d8e7c574286be02694ed8d87e716ab17211",
  "data_path": "crypto_history.jsonl",
  "dataset_id": "crypto_history",
  "endpoint_path": "/offline-replay/post-mcp-materialization",
  "key_fields": [
    "ticker",
    "t"
  ],
  "market": "Crypto",
  "materialization_status": "VERIFIED",
  "params": {
    "fixture": "daily-v1"
  },
  "requirement": "CORE",
  "research_cutoff": "2026-09-28T23:59:59Z",
  "retrieved_at": "2026-09-29T00:00:00Z",
  "row_count": 390,
  "run_id": "replay-daily-v1",
  "sort_fields": [
    "ticker",
    "t"
  ],
  "source_chunks": []
}
